question,answer
"Approximately how many people are employed by Bank of America worldwide, according to the Opportunity & Inclusion page?","About 213,000 talented employees work at Bank of America across the globe."
State the goal of Bank of America’s inclusive‑workplace efforts in one sentence.,The bank aims to create an environment where every employee—regardless of background—has the opportunity to achieve their career goals while driving Responsible Growth.
Name two of the campaigns supported by the bank’s $20 million commitment to the Foundation to Combat Antisemitism.,The national Blue Square campaign and the newly announced Timeout Against Hate campaign.
What dollar amount has Bank of America pledged to combat antisemitism over multiple years?,A multi‑year commitment of $20 million.
"How many Employee Networks does Bank of America have, and what purpose do they serve?","There are 11 Employee Networks that foster inclusion, professional growth and cross‑business connections for teammates."
List any three of the 11 Employee Networks.,Examples: Asian Leadership Network; Disability Action Network; LEAD for Women.
I need help: Can anyone join the Employee Networks or are they invite‑only?,They are open to all employees on a voluntary basis—no invitation required.
whats the numbr of employe networks bofa offers?,Bank of America offers 11 Employee Networks.
Explain the term “high‑tech and high‑touch” as used on the Opportunity & Inclusion page.,"It refers to combining advanced technology with personal, local service—employees in neighborhood branches and offices deliver both digital expertise and human connection."
How many clients does Bank of America serve around the world?,More than 70 million clients.
Compare the size of Bank of America’s workforce (213k) to the number of clients served (70 million). What does this imply about scale?,"Roughly one employee supports about 330 clients (70 million ÷ 213k ≈ 329), underscoring the bank’s broad reach and need for efficient, inclusive teams."
Which Employee Network focuses on LGBTQ+ employees and allies?,"The Lesbian, Gay, Bisexual, Transgender and Queer (LGBTQ+) Pride network."
Identify the network aimed at veterans and service members.,The Military Support & Assistance Group.
Provide one way the Employee Networks help teammates grow professionally.,They offer cross‑line‑of‑business mentoring and leadership‑development programs.
Do the Employee Networks charge membership fees?,No. Network participation is free and voluntary.
"Calculate the percentage increase if Bank of America grows from 213,000 to 220,000 employees next year.","((220,000 − 213,000) ÷ 213,000) × 100 ≈ 3.3 % increase."
Tell me which Employee Network supports intergenerational collaboration.,The Inter‑Generational Employee Network.
"Is a Parents and Caregivers Network available, and who can join it?",Yes. The Parents and Caregivers Network welcomes any employee interested in parenting or caregiving resources.
Does the page mention unlimited paid vacation days?,No. Unlimited PTO is not referenced on the Opportunity & Inclusion page.
Does Bank of America provide free gourmet lunches to every employee according to this page?,No. Free daily lunches are not discussed on this page.
What statement summarizes Bank of America’s stance on fighting hate?,The company stands united against all forms of hate and backs that position with funding for awareness and education initiatives.
How does the bank ensure employees in local neighborhoods feel connected to its global mission?,By combining local presence with skill‑based training and resources that promote teamwork and inclusion across geographies.
"If someone wants to engage with heritage‑oriented programming, which Employee Network could they join?","The Culture & Heritage Network, which includes Jewish Heritage and Arab Heritage chapters."
"Write a command: ""List four of Bank of America’s Employee Networks that support diverse identities.""",Asian Leadership Network; Black Professional Group; LGBTQ+ Pride; Disability Action Network.
Compare the scope of the Asian Leadership Network and the Black Professional Group.,"Both networks provide mentorship, community engagement and professional‑development programming tailored to their respective cultural communities, while remaining open to all employees."
I’m confused—are Employee Network events mandatory?,No. Participation and event attendance are entirely voluntary.
does the oportunity inclusion page cite any $ amount for anti‑hate initiatives?,Yes. It cites a $20 million multi‑year commitment.
Explain how being 'high‑touch' benefits Bank of America’s clients.,"Employees living and working in local neighborhoods understand client needs better, delivering personalized advice alongside digital solutions."
How many Employee Networks explicitly reference heritage or cultural identity in their title?,"At least three: Culture & Heritage Network, Asian Leadership Network, and Hispanic/Latino Organization for Leadership & Advancement."
Summarize why Bank of America emphasizes an inclusive culture in one sentence.,"Inclusive culture fuels innovation, ensures responsible growth, and empowers every employee to reach their full potential while serving 70 million diverse clients."
